{
  "schemaVersion": 2,
  "version": 1,
  "namespace": "openuc2",
  "metadata": {
    "displayName": "UC2 DEP Chip 8x6",
    "displayCategory": "wellPlate",
    "displayVolumeUnits": "µL",
    "tags": ["dep-chip", "uc2", "microfluidic"]
  },
  "brand": {"brand": "openUC2", "brandId": [], "links": []},
  "parameters": {
    "format": "irregular",
    "isTiprack": false,
    "loadName": "dep_chip_8x6_uc2",
    "isMagneticModuleCompatible": false,
    "quirks": [],
    "isDeckSlotCompatible": true
  },
  "ordering": [
    ["A1", "B1", "C1", "D1", "E1", "F1"],
    ["A2", "B2", "C2", "D2", "E2", "F2"],
    ["A3", "B3", "C3", "D3", "E3", "F3"],
    ["A4", "B4", "C4", "D4", "E4", "F4"],
    ["A5", "B5", "C5", "D5", "E5", "F5"],
    ["A6", "B6", "C6", "D6", "E6", "F6"],
    ["A7", "B7", "C7", "D7", "E7", "F7"],
    ["A8", "B8", "C8", "D8", "E8", "F8"]
  ],
  "cornerOffsetFromSlot": {"x": 0.0, "y": 0.0, "z": 0.0},
  "dimensions": {
    "xDimension": 25.0,
    "yDimension": 20.0,
    "zDimension": 1.0
  },
  "wells": {
    "A1": {"shape": "circular", "depth": 0.1, "totalLiquidVolume": 1.0, "x": 4.5, "y": 17.5, "z": 0.0, "diameter": 1.5},
    "A2": {"shape": "circular", "depth": 0.1, "totalLiquidVolume": 1.0, "x": 6.5, "y": 17.5, "z": 0.0, "diameter": 1.5},
    "A3": {"shape": "circular", "depth": 0.1, "totalLiquidVolume": 1.0, "x": 8.5, "y": 17.5, "z": 0.0, "diameter": 1.5},
    "A4": {"shape": "circular", "depth": 0.1, "totalLiquidVolume": 1.0, "x": 10.5, "y": 17.5, "z": 0.0, "diameter": 1.5},
    "A5": {"shape": "circular", "depth": 0.1, "totalLiquidVolume": 1.0, "x": 12.5, "y": 17.5, "z": 0.0, "diameter": 1.5},
    "A6": {"shape": "circular", "depth": 0.1, "totalLiquidVolume": 1.0, "x": 14.5, "y": 17.5, "z": 0.0, "diameter": 1.5},
    "A7": {"shape": "circular", "depth": 0.1, "totalLiquidVolume": 1.0, "x": 16.5, "y": 17.5, "z": 0.0, "diameter": 1.5},
    "A8": {"shape": "circular", "depth": 0.1, "totalLiquidVolume": 1.0, "x": 18.5, "y": 17.5, "z": 0.0, "diameter": 1.5},
    "B1": {"shape": "circular", "depth": 0.1, "totalLiquidVolume": 1.0, "x": 4.5, "y": 15.5, "z": 0.0, "diameter": 1.5},
    "B2": {"shape": "circular", "depth": 0.1, "totalLiquidVolume": 1.0, "x": 6.5, "y": 15.5, "z": 0.0, "diameter": 1.5},
    "B3": {"shape": "circular", "depth": 0.1, "totalLiquidVolume": 1.0, "x": 8.5, "y": 15.5, "z": 0.0, "diameter": 1.5},
    "B4": {"shape": "circular", "depth": 0.1, "totalLiquidVolume": 1.0, "x": 10.5, "y": 15.5, "z": 0.0, "diameter": 1.5},
    "B5": {"shape": "circular", "depth": 0.1, "totalLiquidVolume": 1.0, "x": 12.5, "y": 15.5, "z": 0.0, "diameter": 1.5},
    "B6": {"shape": "circular", "depth": 0.1, "totalLiquidVolume": 1.0, "x": 14.5, "y": 15.5, "z": 0.0, "diameter": 1.5},
    "B7": {"shape": "circular", "depth": 0.1, "totalLiquidVolume": 1.0, "x": 16.5, "y": 15.5, "z": 0.0, "diameter": 1.5},
    "B8": {"shape": "circular", "depth": 0.1, "totalLiquidVolume": 1.0, "x": 18.5, "y": 15.5, "z": 0.0, "diameter": 1.5},
    "C1": {"shape": "circular", "depth": 0.1, "totalLiquidVolume": 1.0, "x": 4.5, "y": 13.5, "z": 0.0, "diameter": 1.5},
    "C2": {"shape": "circular", "depth": 0.1, "totalLiquidVolume": 1.0, "x": 6.5, "y": 13.5, "z": 0.0, "diameter": 1.5},
    "C3": {"shape": "circular", "depth": 0.1, "totalLiquidVolume": 1.0, "x": 8.5, "y": 13.5, "z": 0.0, "diameter": 1.5},
    "C4": {"shape": "circular", "depth": 0.1, "totalLiquidVolume": 1.0, "x": 10.5, "y": 13.5, "z": 0.0, "diameter": 1.5},
    "C5": {"shape": "circular", "depth": 0.1, "totalLiquidVolume": 1.0, "x": 12.5, "y": 13.5, "z": 0.0, "diameter": 1.5},
    "C6": {"shape": "circular", "depth": 0.1, "totalLiquidVolume": 1.0, "x": 14.5, "y": 13.5, "z": 0.0, "diameter": 1.5},
    "C7": {"shape": "circular", "depth": 0.1, "totalLiquidVolume": 1.0, "x": 16.5, "y": 13.5, "z": 0.0, "diameter": 1.5},
    "C8": {"shape": "circular", "depth": 0.1, "totalLiquidVolume": 1.0, "x": 18.5, "y": 13.5, "z": 0.0, "diameter": 1.5},
    "D1": {"shape": "circular", "depth": 0.1, "totalLiquidVolume": 1.0, "x": 4.5, "y": 11.5, "z": 0.0, "diameter": 1.5},
    "D2": {"shape": "circular", "depth": 0.1, "totalLiquidVolume": 1.0, "x": 6.5, "y": 11.5, "z": 0.0, "diameter": 1.5},
    "D3": {"shape": "circular", "depth": 0.1, "totalLiquidVolume": 1.0, "x": 8.5, "y": 11.5, "z": 0.0, "diameter": 1.5},
    "D4": {"shape": "circular", "depth": 0.1, "totalLiquidVolume": 1.0, "x": 10.5, "y": 11.5, "z": 0.0, "diameter": 1.5},
    "D5": {"shape": "circular", "depth": 0.1, "totalLiquidVolume": 1.0, "x": 12.5, "y": 11.5, "z": 0.0, "diameter": 1.5},
    "D6": {"shape": "circular", "depth": 0.1, "totalLiquidVolume": 1.0, "x": 14.5, "y": 11.5, "z": 0.0, "diameter": 1.5},
    "D7": {"shape": "circular", "depth": 0.1, "totalLiquidVolume": 1.0, "x": 16.5, "y": 11.5, "z": 0.0, "diameter": 1.5},
    "D8": {"shape": "circular", "depth": 0.1, "totalLiquidVolume": 1.0, "x": 18.5, "y": 11.5, "z": 0.0, "diameter": 1.5},
    "E1": {"shape": "circular", "depth": 0.1, "totalLiquidVolume": 1.0, "x": 4.5, "y": 9.5, "z": 0.0, "diameter": 1.5},
    "E2": {"shape": "circular", "depth": 0.1, "totalLiquidVolume": 1.0, "x": 6.5, "y": 9.5, "z": 0.0, "diameter": 1.5},
    "E3": {"shape": "circular", "depth": 0.1, "totalLiquidVolume": 1.0, "x": 8.5, "y": 9.5, "z": 0.0, "diameter": 1.5},
    "E4": {"shape": "circular", "depth": 0.1, "totalLiquidVolume": 1.0, "x": 10.5, "y": 9.5, "z": 0.0, "diameter": 1.5},
    "E5": {"shape": "circular", "depth": 0.1, "totalLiquidVolume": 1.0, "x": 12.5, "y": 9.5, "z": 0.0, "diameter": 1.5},
    "E6": {"shape": "circular", "depth": 0.1, "totalLiquidVolume": 1.0, "x": 14.5, "y": 9.5, "z": 0.0, "diameter": 1.5},
    "E7": {"shape": "circular", "depth": 0.1, "totalLiquidVolume": 1.0, "x": 16.5, "y": 9.5, "z": 0.0, "diameter": 1.5},
    "E8": {"shape": "circular", "depth": 0.1, "totalLiquidVolume": 1.0, "x": 18.5, "y": 9.5, "z": 0.0, "diameter": 1.5},
    "F1": {"shape": "circular", "depth": 0.1, "totalLiquidVolume": 1.0, "x": 4.5, "y": 7.5, "z": 0.0, "diameter": 1.5},
    "F2": {"shape": "circular", "depth": 0.1, "totalLiquidVolume": 1.0, "x": 6.5, "y": 7.5, "z": 0.0, "diameter": 1.5},
    "F3": {"shape": "circular", "depth": 0.1, "totalLiquidVolume": 1.0, "x": 8.5, "y": 7.5, "z": 0.0, "diameter": 1.5},
    "F4": {"shape": "circular", "depth": 0.1, "totalLiquidVolume": 1.0, "x": 10.5, "y": 7.5, "z": 0.0, "diameter": 1.5},
    "F5": {"shape": "circular", "depth": 0.1, "totalLiquidVolume": 1.0, "x": 12.5, "y": 7.5, "z": 0.0, "diameter": 1.5},
    "F6": {"shape": "circular", "depth": 0.1, "totalLiquidVolume": 1.0, "x": 14.5, "y": 7.5, "z": 0.0, "diameter": 1.5},
    "F7": {"shape": "circular", "depth": 0.1, "totalLiquidVolume": 1.0, "x": 16.5, "y": 7.5, "z": 0.0, "diameter": 1.5},
    "F8": {"shape": "circular", "depth": 0.1, "totalLiquidVolume": 1.0, "x": 18.5, "y": 7.5, "z": 0.0, "diameter": 1.5}
  },
  "groups": [
    {"wells": [], "metadata": {"displayCategory": "wellPlate"}}
  ]
}
