{
  "schemaVersion": 2,
  "version": 1,
  "namespace": "openuc2",
  "metadata": {
    "displayName": "Ibidi µ-Slide 8 Well high",
    "displayCategory": "wellPlate",
    "displayVolumeUnits": "µL",
    "tags": ["slide", "imaging", "live-cell", "high"]
  },
  "brand": {"brand": "Ibidi", "brandId": ["80806"], "links": ["https://ibidi.com/chambered-coverslips/143--slide-8-well-high.html"]},
  "parameters": {
    "format": "irregular",
    "isTiprack": false,
    "loadName": "ibidi_8well_muslide_high",
    "isMagneticModuleCompatible": false,
    "quirks": [],
    "isDeckSlotCompatible": true
  },
  "ordering": [
    ["A1", "B1"],
    ["A2", "B2"],
    ["A3", "B3"],
    ["A4", "B4"]
  ],
  "cornerOffsetFromSlot": {"x": 0.0, "y": 0.0, "z": 0.0},
  "dimensions": {
    "xDimension": 75.5,
    "yDimension": 25.5,
    "zDimension": 12.8
  },
  "wells": {
    "A1": {"shape": "rectangular", "depth": 6.8, "totalLiquidVolume": 300.0, "x": 19.5, "y": 18.2, "z": 0.0, "xDimension": 11.0, "yDimension": 10.0},
    "A2": {"shape": "rectangular", "depth": 6.8, "totalLiquidVolume": 300.0, "x": 31.7, "y": 18.2, "z": 0.0, "xDimension": 11.0, "yDimension": 10.0},
    "A3": {"shape": "rectangular", "depth": 6.8, "totalLiquidVolume": 300.0, "x": 43.9, "y": 18.2, "z": 0.0, "xDimension": 11.0, "yDimension": 10.0},
    "A4": {"shape": "rectangular", "depth": 6.8, "totalLiquidVolume": 300.0, "x": 56.1, "y": 18.2, "z": 0.0, "xDimension": 11.0, "yDimension": 10.0},
    "B1": {"shape": "rectangular", "depth": 6.8, "totalLiquidVolume": 300.0, "x": 19.5, "y": 7.3, "z": 0.0, "xDimension": 11.0, "yDimension": 10.0},
    "B2": {"shape": "rectangular", "depth": 6.8, "totalLiquidVolume": 300.0, "x": 31.7, "y": 7.3, "z": 0.0, "xDimension": 11.0, "yDimension": 10.0},
    "B3": {"shape": "rectangular", "depth": 6.8, "totalLiquidVolume": 300.0, "x": 43.9, "y": 7.3, "z": 0.0, "xDimension": 11.0, "yDimension": 10.0},
    "B4": {"shape": "rectangular", "depth": 6.8, "totalLiquidVolume": 300.0, "x": 56.1, "y": 7.3, "z": 0.0, "xDimension": 11.0, "yDimension": 10.0}
  },
  "groups": [
    {
      "wells": ["A1", "A2", "A3", "A4", "B1", "B2", "B3", "B4"],
      "metadata": {"displayCategory": "wellPlate", "displayName": "µ-Slide 8 Well high"}
    }
  ]
}
